{
  "schema": "agent-memory-staging-retrieval-parity-input-v1",
  "classification": "staging_external",
  "environment": "staging",
  "evaluation_id": "replace-with-evaluation-id",
  "threshold_version": "replace-with-threshold-version",
  "dataset_version": "replace-with-dataset-version",
  "inventory_id": "replace-with-inventory-id",
  "inventory_receipt_sha256": "aaaaaaaaaaaaaaaaaaaaaaaaaaaaaaaaaaaaaaaaaaaaaaaaaaaaaaaaaaaaaaaa",
  "plan_id": "replace-with-plan-id",
  "plan_receipt_sha256": "bbbbbbbbbbbbbbbbbbbbbbbbbbbbbbbbbbbbbbbbbbbbbbbbbbbbbbbbbbbbbbbb",
  "change_id": "replace-with-change-id",
  "change_receipt_sha256": "cccccccccccccccccccccccccccccccccccccccccccccccccccccccccccccccc",
  "release_id": "replace-with-release-id",
  "release_receipt_sha256": "dddddddddddddddddddddddddddddddddddddddddddddddddddddddddddddddd",
  "threshold_decision_sha256": "eeeeeeeeeeeeeeeeeeeeeeeeeeeeeeeeeeeeeeeeeeeeeeeeeeeeeeeeeeeeeeee",
  "parity_report_sha256": "ffffffffffffffffffffffffffffffffffffffffffffffffffffffffffffffff",
  "threshold_approved_at": "2026-08-10T07:00:00Z",
  "evaluation_started_at": "2026-08-10T08:00:00Z",
  "evaluation_completed_at": "2026-08-10T09:00:00Z",
  "generated_at": "2026-08-10T09:15:00Z",
  "case_count": 250,
  "minimum_top_k_overlap": 0.95,
  "maximum_normalized_score_delta": 0.20,
  "observed_top_k_overlap": 0.98,
  "observed_maximum_normalized_score_delta": 0.10,
  "ready": true,
  "checks": [
    {"id": "representative_dataset_approved", "outcome": "passed", "evidence_sha256": "1111111111111111111111111111111111111111111111111111111111111111"},
    {"id": "top_k_overlap_threshold_met", "outcome": "passed", "evidence_sha256": "2222222222222222222222222222222222222222222222222222222222222222"},
    {"id": "normalized_score_delta_threshold_met", "outcome": "passed", "evidence_sha256": "3333333333333333333333333333333333333333333333333333333333333333"},
    {"id": "exact_term_winner_equivalent", "outcome": "passed", "evidence_sha256": "4444444444444444444444444444444444444444444444444444444444444444"},
    {"id": "feedback_preference_equivalent", "outcome": "passed", "evidence_sha256": "5555555555555555555555555555555555555555555555555555555555555555"},
    {"id": "decay_behavior_equivalent", "outcome": "passed", "evidence_sha256": "6666666666666666666666666666666666666666666666666666666666666666"},
    {"id": "suppression_behavior_equivalent", "outcome": "passed", "evidence_sha256": "7777777777777777777777777777777777777777777777777777777777777777"},
    {"id": "citation_resolution_equivalent", "outcome": "passed", "evidence_sha256": "8888888888888888888888888888888888888888888888888888888888888888"}
  ]
}
